{
  "id": "8c2a7f24-1b40-4dca-9ad9-31d2b4f3e9a1",
  "name": "Checkout p95 latency above 500ms",
  "status": "active",
  "query": "p95(http.server.duration{service=\"checkout-api\"})",
  "threshold": { "operator": ">", "value": 500 },
  "interval": "5m",
  "notification_channels": ["slack-oncall", "pagerduty-checkout"],
  "created_at": "2026-04-12T18:24:11Z",
  "updated_at": "2026-05-20T09:02:44Z"
}
